metadataid,data_title,resp_party,resp_email,year,char_set,ref_system,scale,lineage,citation,disclaimer,language
889,Luama Katanga Hunting Area,"Wildlife Conservation Society, Albertine Rift Programme, Kampala, Uganda",aplumptre@wcs.org,2011,UTF-8,"WGS 84, UTM Zone 35S",Not Reported,"The boundaries are based on old map obtained by WCS in Kalemie from the Ministry of Environment Office which shows where the borders are aligned; verified on the ground where local peoples recognise the boundaries",,Not Reported,English
903,National and Local Marine Protected Areas in Indonesia,"Ministry of Marine Affairs and Fisheries, Indonesia",suraji_a@yahoo.com,2011,UTF-8,WGS 84,250000 (national) and 50000 (local),Not Reported,,Not Reported,English and Indonesian
905,"Indigenous Areas of Brazil
","Coordenação Geral de Geoprocessamento (CGGEO)/ Fundação Nacional do Índio (FUNAI ), Brazil
","cggeo.informacao@funai.gov.br
",2011,UTF-8,"SAD 69
","100000
",Not Reported,,Not Reported,Portuguese
906,Protected Areas of Guyana,"Natural Resources Management Division, Environmental Protection Agency, Guyana",epa@epaguyana.org,2011,UTF-8,GCS Provisional S American 1956,Not Reported,Not Reported,,Not Reported,English
908,Protected Areas of El Salvador,"Ministerio de Medio Ambiente y Recursos Naturales (MARN)/AECID, El Salvador",medioambiente@marn.gob.sv,2011,UTF-8,WGS 84,Not Reported,Not Reported,,Not Reported,English
937,Marine and coastal areas of Venezuela,"Fundación para la Defensa de la Naturaleza (FUDENA), Caracas, Venezuela",Not Reported,1995,Not Reported,Not Reported,Not Reported,Not Reported,"Díaz Martín, D., E. González, and D. Hernández (1995) Prioridades de Conservación en las Áreas Marino-Costeras de Venezuela. Fundación para la Defensa de la Naturaleza, Caracas.",Not Reported,Spanish
909,Protected Areas of Jamaica,"Mapping and Data Management, National Environment and Planning Agency, Jamaica","gbennett@nepa.gov.jm; ranya.reid@nepa.gov.jm",2010,UTF-8,WGS 84 (The original datasets were created using the JAD 69 AND 2001 Coordinate Reference System),"50000
",The boundaries of the various  protected areas were created between 1997 and 2002  [1992- A Plan for a System of Protected Areas in Jamaica first developed 1997- the Policy for Jamaica’s System of Protected Areas developed revised 2004],"Jamaica's System of Protected Areas (2010) National Environment and Planning Agency (NEPA), Jamaica.",Not Reported,English
910,"Kafa UNESCO Biosphere Reserve, Ethiopia","Head of Project Office in Ethiopia, The Nature and Biodiversity Conservation Union, Addis Ababa, Ethiopia",elisabet_dresden@gmx.de,2010,UTF-8,WGS 84,Not Reported,Not Reported,,Not Reported,English
913,"Protected Areas of Egypt
","Egyptian Environmental Affairs Agency, Ministry of Environment",khaledallam4@hotmail.com,2011,UTF-8,WGS 84,Not Reported,Not Reported,,Not Reported,English and Arabic
916,HELCOM Baltic Sea Protected Areas (BSPA),"Helsinki Commission (HELCOM) (Baltic Marine Environment Protection Commission), Katajanokanlaituri 6 B, FI-00160, Helsinki, Finland",joni.kaitaranta@helcom.fi,2010,UTF-8,WGS 84 (The original data sets were created using ETRS89 LAEA),100000,This dataset is compiled from data submitted by HELCOM Contracting States and was updated for the Implementation report on the status and ecological coherence of the HELCOM BSPA network. (2010) Balt. Sea Environ. Proc. No. 124B.,HELCOM (2016),Not Reported,English
921,Marine Protected Areas with No Take,"MPA Global, UNEP-WCMC & WWF",protectedareas@unep-wcmc.org,2008,UTF-8,WGS 84,Not Reported,MPAs with no-take areas were integrated from the MPA Global dataset,"Wood, L. J. (2008). MPA Global: A database of the world's marine protected areas. Sea Around Us Project, UNEP-WCMC & WWF",Not Reported,English
922,European Common Database on Designated Areas (ECDDA version 9) as provided by the European Environment Agency (EEA),European Environment Agency (EEA),Mette.Lund@eea.europa.eu,2011,ANSI,ETRS LAEA 89 5210 converted to WGS 84,Various,Submitted by National Reference Centres to the European Environment Agency's ReportNet then collated by the European Topic Centre on Biological Diversity and formatted for the WDPA including only records with dissemination code '01',,Not Reported,Multiple
923,Protected areas of China,"International Cooperation Department, Ministry of Construction, China",Not Reported,1990,Not Reported,Not Reported,Not Reported,In litteris - in a letter or other documented correspondence,,Not Reported,Not Reported
924,Protected areas of India,"Department of Protected Areas Network, Wildlife Management & Conservation Education, Wildlife Institute of India",Not Reported,2003,Not Reported,Not Reported,Not Reported,"Supplied attributes for UN List 2003, June 2003",,Not Reported,Not Reported
925,Wildlife protected area network in India,"Ministry of Environment and Forests and Wildlife, Government of India",Not Reported,1988,Not Reported,Not Reported,Not Reported,"Information from Rodgers, W.A. and Panwar, H.S. (1988) Planning a Wildlife Protected Area Network in India. A report prepared for the Ministry of Environment and Forests and Wildlife, Government of India, volumes 1 and 2.","Rodgers, W.A. and Panwar, H.S. (1988) Planning a Wildlife Protected Area Network in India. A report prepared for the Ministry of Environment and Forests and Wildlife, Government of India, volumes 1 and 2.",Not Reported,English
927,"Nanda Devi MAB Biosphere Reserve, India",IUCN and UNESCO,Not Reported,2005,Not Reported,Not Reported,Not Reported,IUCN World Heritage Evaluation Report (Valley of Flowers National Park - India) May 2005 & Nanda Devi Biosphere Reserve Nomination for UNESCO-MAB net dated June 2002. The Nanda Devi National Park forms the core zone to this reserve.,,Not Reported,English
928,UNESCO-MAB Biosphere Reserves,UNESCO-MAB,Not Reported,2003,Not Reported,Not Reported,Not Reported,MAB UNESCO Biosphere Directory.  http://www2.unesco.org/mab/br/brdir/directory/biores.asp?mode=all&code=CAN+12\fs17. Accessed Jan & March 2003.,,Not Reported,English
929,National Parks of Indonesia,WWF Indonesia & UNEP-WCMC,Not Reported,2004,Not Reported,Not Reported,Not Reported,"WWF Press Release entitled ""Protection boost for elephants, tigers and orang-utans in Indonesian rainforests"" dated 12 Feb 2004, and BirdLife Press Release, 11th Nov. 2004 entitled ""Historic national park declaration on Halmahera"".",,Not Reported,English
930,"Protected areas in Nantu Forest, Indonesia",UNEP-WCMC,Not Reported,2003,Not Reported,Not Reported,Not Reported,"Information from article by Mustari, A.H. et al. (2003). Accessed 11th Feb. 2005.","Mustari, A.H. et al. (2003) Environmental Education in Nantu Wildlife Reserve, Gorontalo, Issue 6 - 21.",Not Reported,English
932,Forest Reserves of Kenya,Kenya Indigenous Forest Conservation Programme (KIFCON),Not Reported,1993,Not Reported,Not Reported,Not Reported,Not Reported,,Not Reported,English
933,Protected areas of Kenya,Kenya Wildlife Service (KWS),mutero@kws.go.ke,1993,Not Reported,WGS 84,Not Reported,Not Reported,,Not Reported,English
936,Protected areas of Venezuela,"Ministerio del Ambiente y los Recursos Naturales Renovables (MARNR), Venezuelan Department of Environment",Not Reported,1992,Not Reported,Not Reported,Not Reported,Not Reported,,Not Reported,English
938,Protected areas of Venezuela,"Fundación para la Defensa de la Naturaleza (FUDENA), Caracas, Venezuela",Not Reported,1996,Not Reported,Not Reported,Not Reported,In litteris - in a letter or other documented correspondence,,Not Reported,Not Reported
940,Protected areas of Venezuela,"Instituto Nacional de Recursos Naturales (INRENA), Venezuela",Not Reported,1996,Not Reported,Not Reported,Not Reported,In litteris - in a letter or other documented correspondence,,Not Reported,Not Reported
941,Forest reserves of Zambia,"Forestry Department (FD), Zambia",Not Reported,1993,Not Reported,Not Reported,Not Reported,Not Reported,,Not Reported,Not Reported
942,Natural monuments of Zambia,"National Heritage Conservation Commission (NHCC), Zambia",Not Reported,1993,Not Reported,Not Reported,Not Reported,Not Reported,,Not Reported,Not Reported
943,National parks of Zambia,Zambia Wildlife Authority (ZAWA),Not Reported,2003,Not Reported,Not Reported,Not Reported,"Reply to 2003 UN List request. Previously sourced from MacKinnon, J. and K. MacKinnon. 1986. Review of the protected areas system in the Afrotropical realm. IUCN Gland, Switzerland and Cambridge.",,Not Reported,Not Reported
946,UNESCO World Heritage Sites,IUCN World Heritage Programme,yichuan.shi@iucn.org,2012,UTF-8,WGS 84,Various,"Geometry provided by States Parties or digitised from UNESCO nominations, evaluation reports, and retrospective inventory process maps",,Not Reported,English
949,Diawling National Park,UNEP-WCMC,Not Reported,2005,Not Reported,Not Reported,Not Reported,"Diawling National Park website (accessed October 2005), http://www.pnd.mr",,Not Reported,English
955,Common Database on Designated Areas (CDDA) (2004),European Environment Agency (EEA),Not Reported,2004,Not Reported,Not Reported,Not Reported,"European Update, Aug 2004",,Not Reported,English
956,Common Database on Designated Areas (CDDA) (2006),European Environment Agency (EEA),Not Reported,2006,Not Reported,Not Reported,Not Reported,Not Reported,,Not Reported,English
958,"Cape Royds, Ross Island",UNEP-WCMC,Not Reported,Not Reported,Not Reported,Not Reported,Not Reported,"Committee for Environmental Protection (CEP) website, http://www.cep.aq/apa/aspa/sites/aspa121/ASPA121RoydsPlan.htm",,Not Reported,English
961,Jaragua - Bahoruco - Enriquillo MAB Biosphere Reserve,UNEP-WCMC from UNESCO-MAB Biosphere Directory,Not Reported,Not Reported,Not Reported,Not Reported,Not Reported,http://www2.unesco.org/mab/br/brdir/directory/biores.asp?code=DOM+01&mode=all\fs17,,Not Reported,English
964,Collaborative Australian Protected Areas Database (CAPAD),Environment Australia (EA),Not Reported,2002,Not Reported,Not Reported,Not Reported,"CAPAD 2002 supplied by Environment Australia (EA) for UN List 2003, July 2003. Checked against CAPAD web (website dated 23 Sep 2003), October 2003. Checked using CAPAD web (website updated 23 Sept 2003), Oct 2003.",,Not Reported,English
967,Protected Areas of Vanuatu,"Director, Vanuatu Protected Areas Initiative, Wan Tok Environment Centre, Santo, Vanuatu",Not Reported,2003,Not Reported,Not Reported,Not Reported,"Updated attribute information used for UN List 2003 update, July 2003",,Not Reported,English
970,Protected Areas of Samoa,Ministry of Natural Resources & Environment for Samoa,Not Reported,2003,Not Reported,Not Reported,Not Reported,UN List 2003 reply. April 2003,,Not Reported,English
973,Protected Areas of Senegal,UNEP-WCMC,Not Reported,2007,Not Reported,Not Reported,Not Reported,"Attribute information taken from Ministere de l'Environnement et de la Protection de la Nature website, http://www.environnement.gouv.sn/, accessed October 2007",,Not Reported,English
976,Bukit Kuala Selangor,UNEP-WCMC,Not Reported,2005,Not Reported,Not Reported,Not Reported,"Department of Wildlife and National Parks (Malaysian Peninsula) Website, http://www.wildlife.gov.my/, accessed February 2005.",,Not Reported,English
979,Protected Areas of Israel,"Nature and National Parks Protection Authority, Israel",Not Reported,2003,Not Reported,Not Reported,Not Reported,"Reply to UNList 2003 request, 17 Nov 2003",,Not Reported,English
982,Pacific region protected areas,"University of Queensland, Australia",Not Reported,2003,Not Reported,Not Reported,Not Reported,"Research on Pacific region protected areas by Joanna Axford, December 2003",,Not Reported,English
983,Pacific region protected areas,"University of Queensland, Australia",Not Reported,2004,Not Reported,Not Reported,Not Reported,"Research on Pacific region protected areas by Joanna Axford, 2004",,Not Reported,English
984,Pacific region protected areas,"University of Queensland, Australia",Not Reported,2005,Not Reported,Not Reported,Not Reported,"Research on Pacific region PAs by J. Axford, Nov 2005. Other sources: Ministère de l`écologie et du développement durable de France 2004. Les réponses en Nouvelle Calédonie;  La réglementation de l`environnement en Province Sud, Nouvelle-Calédonie 2003.",,Not Reported,English
986,Protected Areas of Vietnam,BirdLife International,Not Reported,2001,Not Reported,Not Reported,Not Reported,"Sourcebook of Existing & Proposed Protected Areas in Vietnam - BirdLife Int. (19/02/01), accessed 04/04/2005",,Not Reported,English
987,St. Eustatius (Statia),UNEP-WCMC,Not Reported,2004,Not Reported,Not Reported,Not Reported,"St. Eustatius National Parks website (STE-NA-PA), accessed 13/04/2004",,Not Reported,English
988,UNESCO-MAB Biosphere Reserve,UNESCO-MAB,Not Reported,2004,Not Reported,Not Reported,Not Reported,"Updated using MAB website (updated 3rd June 2004), accessed June 2004 .Also: World Heritage Sites that are also Biosphere Reserves, July 2003",,Not Reported,English
992,Prickly Pear & Sea Island,"Department of Physical Planning, Anguilla Government",Not Reported,2003,Not Reported,Not Reported,Not Reported,"Marine Parks Ordinance 1993. Latest Info: Dept of Physical Planning, Anguilla Government. UN List 2003 reply. May 2003.",,Not Reported,English
996,Protected Areas of Nigeria,"Federal Ministry of Environment, Nigeria.",Not Reported,2007,Not Reported,Not Reported,Not Reported,"Personal communication. Matthew P.O. Dore, Director, Federal Ministry of Environment, Nigeria. (16/01/2007)",,Not Reported,English
997,Protected Areas of Israel,Not Reported,Not Reported,1983,Not Reported,Not Reported,Not Reported,"Nature Reserves in Israel and their Status, Jan 1983.",,Not Reported,English
1003,Protected Areas of Bahamas,Bahamas National Trust,Not Reported,1991,Not Reported,Not Reported,Not Reported,"Bahamas National Trust in litt, 26/04/1991.",,Not Reported,English
1025,Protected Areas of Bahrain,"National Commission for Wildlife Protection, Bahrein",Not Reported,2003,Not Reported,Not Reported,Not Reported,Official Agency (National Commission for Wildlife Protection) reply to UN List 2003 request.,,Not Reported,English
1026,Protected Areas of Thailand,Not Reported,Not Reported,1996,Not Reported,Not Reported,Not Reported,Previous Source: Official Agency reply to UN List 1996 request.,,Not Reported,English
1028,Protected Areas of Antarctica,Not Reported,Not Reported,1992,Not Reported,Not Reported,Not Reported,"Previous Source: P. Dingwall, 1992.",,Not Reported,English
1038,Protected Areas of Bahamas,Not Reported,Not Reported,1986,Not Reported,Not Reported,Not Reported,Not Reported,,Not Reported,English
1041,Protected areas of the Caribbean,UNEP Caribbean Environment Programme (CEP),Not Reported,2002,Not Reported,Not Reported,Not Reported,"Technical reports for Puerto Rico No. 36 dated 1996, October 2002.","UNEP Caribbean Environment Programme (CEP) tech reports for Puerto Rico No. 36 dated 1996 (see doc link), October 2002.",Not Reported,English
1042,Pakistan Protected Areas,UNEP/IUCN,Not Reported,1988,Not Reported,Not Reported,Not Reported,"UNEP/IUCN, 1988.",,Not Reported,English
1057,Protected Areas of Falkland Islands,Falkland Islands Government,Imarengo@env.institute.ac.fk,1993,Not Reported,Not Reported,Not Reported,Agency response to UN List 1993 data request,,Not Reported,English
1061,Protected Areas of New Zealand,"Department of Conservation (DOC), Te Papa Atawhai, Wellington, New Zealand",Not Reported,2005,Not Reported,Not Reported,Not Reported,2003 UN List Updates,,Not Reported,English
1083,Protected Areas of Mauritanie,"Insititut Geographique National  - Paris, France",Not Reported,1980,Not Reported,Not Reported,1:2500000,Not Reported,,Not Reported,English
1097,"Protected Areas ASEAN (Brunei Darussalam, Cambodia, Indonesia, Lao PDR, Malaysia, Philippines, Singapore, Thailand, Vietnam)",Association of Southeast Asian Nations (ASEAN) Regional Centre for Nature Conservation (ARCBC),Not Reported,2005,Not Reported,Not Reported,Not Reported,"Dataset date 2004, February 2005. Also: ARCBC Wetlands of South East Asia Website, accessed 4th February 2005.",,Not Reported,English
1110,Ile Pam,Not Reported,Not Reported,2005,Not Reported,Not Reported,Not Reported,Personal communication. Simple formatting of the name,,Not Reported,English
1111,Marine Protected Areas in South East Asia,"Ass. of Southeast Asian Nations (ASEAN)  Regional Centre for Nature Conservation (ARCBC), Univ. of Philippines Marine Science Institute (UP-MSI), Asian Bureau for Conservation (ABC), Dept. of Environment and Nat. Resources - Philippines (DENR)",Not Reported,2002,Not Reported,Not Reported,Not Reported,Available at http://arcbc.defined.net/BIS,"ASEAN, UP-MSI, ABC, ARCBC, DENR (2002) Marine Protected Areas in Southeast Asia. Los Banos, Philippines., ASEAN Regional Centre for Biodiversity Conservation, Dept. of Environment and Natural Resources,.142pp.",Not Reported,English
1113,Mediterranean Marine Protected Areas,Not Reported,Not Reported,2005,Not Reported,Not Reported,Not Reported,Available at http://www.wwf.fr/pdf/RepertoireAMP.pdf,"Mabile, S. and Piante, C. (2005) Global Directory of Mediterranean Marine Protected Areas. WWF-France, Paris, France. xii + 132pp.",Not Reported,English
1115,Protected Areas of Hong Kong,"Environmental Protection Department, Hong Kong",Not Reported,1999,Not Reported,Not Reported,Not Reported,http://www.epd.gov.hk/epd/english/environmentinhk/eia_planning/sea/baseline.html,Environmental Protection Department (1999) Environmental Baseline Report Annex B - Sites of Special Scientific Interest.,Not Reported,English
1117,Protected Areas of Anguilla,Anguilla National Trust,antpam@anguillanet.com,2007,Not Reported,Not Reported,Not Reported,"Personal communication. Received by Wabnitz, C. via Email.; Also source: Procter, D. and Fleming, L. V. (eds.) 1999.","Procter, D. and Fleming, L. V. (eds.) (1999) Biodiversity: the UK Overseas Territories. Peterborough, Joint Nature Conservation Committee. 131 pp. Available at http://www.jncc.gov.uk/page-3045",Not Reported,English
1120,Marine Protected Areas Iran,"Department of Natural Resources, Isfahan University of Technology, Iran",Not Reported,2005,Not Reported,Not Reported,Not Reported,"Personal communication. Iran MPA data. Received by Yousefi, R. via Email.",,Not Reported,English
1121,Marine protected areas in the Red Sea and Gulf of Aden,The Regional Organization for the Conservation of the Environment in the Red Sea and Gulf of Aden (PERSGA) & Global Environmental Facility (GEF),Not Reported,2002,Not Reported,Not Reported,Not Reported,Available at http://www.persga.org/Publications/Technical/Technical.asp,"PERSGA and GEF 2002. The Red Sea and Gulf of Aden Regional Network of Marine Protected Areas. Regional Master Plan. PERSGA Technical Series No.1. PERSGA, Jeddah, Saudi Arabia",Not Reported,English
1125,Protected Areas of Hong Kong,"Agriculture Fisheries and Conservation Department Country and Marine Parks Authority, Hong Kong",Not Reported,2004,Not Reported,Not Reported,Not Reported,http://parks.afcd.gov.hk/newmarine/eng/Oparks_info/p2.htm,,Not Reported,English
1127,Protected Areas of Hong Kong,UNEP-WCMC,Not Reported,2005,Not Reported,Not Reported,Not Reported,"Marine Parks Ordinance 1995. 37 (www.legislation.gov.hk/blis_export.nsf/CurAllEngDocAgent?OpenAgent&Chapter=476); Agriculture Fisheries and Conservation Department Country & Marine Parks Authority Management Plan (parks.afcd.gov.hk/newmarine/eng/Oparks_i",,Not Reported,English
1130,Great Nicobar,UNEP-WCMC,Not Reported,2007,Not Reported,Not Reported,Not Reported,"Environment and Forests Andaman Islands (2007) Great Nicobar Biosphere Reserve, Environment and Forests Andaman Islands, http://forest.and.nic.in/default.htm last accessed 21st April 2007",,Not Reported,English
1131,Marine protected coast and reefs of Philippines,"Coastal Conservation and Education Foundation (CCEF), Philippines",Not Reported,2004,Not Reported,Not Reported,Not Reported,"Marine Protected Coast, Reef & Management Database. Other sources: Nat Integr Prot Areas System Act 1992. Republic Act No. 7586 (faolex.fao.org/faolex) (05-08-05); White, A, Coastal Conserv and Educ Found, 2005. (pers. comm.); CCEF datab - IUCN cats.",,Not Reported,English
1142,Phoenix Islands Protected Area,"Ministry of Environment, Lands and Agricultural Development, Kiribati",tukabut@gmail.com,2008,Not Reported,WGS 84,Not Reported,"Original 2008 boundary from Phoenix Islands Protected Area Information Factsheet, Republic of Kiribati - Min. of Environment, Lands and Agricultural Development, CI and New England Aquarium. approx. date February 2008 from www.phoenixislands.org",,Not Reported,English
1146,Association pour le Sauvegarde de la Nature Caladonienne,"Association pour le Sauvegarde de la Nature Caladonienne, Noumea",Not Reported,Not Reported,Not Reported,Not Reported,Not Reported,Not Reported,,Not Reported,English
1174,Krymskoye,IUCN,Not Reported,1977,Not Reported,Not Reported,Not Reported,Not Reported,,Not Reported,English
1175,Teluk Ambon,Not Reported,Not Reported,1991,Not Reported,Not Reported,Not Reported,Personal communication,,Not Reported,English
1176,Khor Al Udeid Fish Sanctuary,"Ministry of Municipal Affairs and Agriculture Decision, Qatar",Not Reported,1993,Not Reported,Not Reported,Not Reported,"Fish sanctuary established by Ministry of Municipal Affairs and Agriculture Decision No. 78, Dec. 1993.",,Not Reported,English
1194,Protected areas of Sierra Leone,"Outamba-Kilimi National Park (OKNP), Sierra Leone",Not Reported,1993,Not Reported,Not Reported,Not Reported,Not Reported,,Not Reported,English
1196,"Segara Anakan, Indonesia","World Nat. Parks Con., Indonesia",Not Reported,1982,Not Reported,Not Reported,Not Reported,'Cons. and Manag. of Man.' 1982,,Not Reported,English
1201,Protected areas of Saint Kitts and Nevis,Not Reported,Not Reported,1986,Not Reported,Not Reported,Not Reported,Not Reported,,Not Reported,English
1202,Protected Areas Pakistan,IUCN/WCMC,Not Reported,1988,Not Reported,Not Reported,Not Reported,Baluchistan Report,,Not Reported,English
1208,Protected Areas Montserrat,Sarita Francis. Montserrat National Trust,mnatrust@candw.ms,1996,Not Reported,Not Reported,Not Reported,In litteris - in a letter or other documented correspondence,,Not Reported,English
1209,Protected areas Yemen,UNEP/IUCN,Not Reported,1988,Not Reported,Not Reported,Not Reported,Not Reported,,Not Reported,English
1218,Hawkes Bay/Sandspit Beaches,Not Reported,Not Reported,1981,Not Reported,Not Reported,Not Reported,Not Reported,,Not Reported,English
1223,"Protected Areas of Kuwait
","Environmental Monitoring Information System of Kuwait (eMISK), Environmental Inspection, Monitoring and Emergency Department (EIMED), Biodiversity and Living Resources Department, Environment Public Authority (EPA), Kuwait",talaat@emisk.org,2012,UTF-8,WGS 84,100000,Provided by eMISK ,"Environmental Monitoring Information System of Kuwait (eMISK), Kuwait Environment Public Authority, 2012 [www.beatona.net and www.emisk.org].",Not Reported,English and Arabic
1225,Gola Rainforest National Park,Royal Society for the Protection of Birds (RSPB),alex.hipkiss@rspb.org.uk,2011,UTF-8,WGS 84,Not Reported,"Boundaries plotted in ArcGIS as result of excersice includeing comparison with original silk maps, documents and checking physical markers. Official schedule printed in Sierra Leone Government Gazzetted Supplement  Vol CXLI, No 87 16th December 2010","Digial Map of the Gola Rainforest National Park, Forestry Division Government of Sierra Leone",Not Reported,English
1230,Protected areas of Paraguay,"Guyra Paraguay, Proyecto Paraguay Silvestre",Not Reported,2004,Not Reported,Not Reported,Not Reported,"Attributes updated by José Cartes (24/09/2004 & 05/10/2004). GIS supplied by Francis Fragano, 07/10/2004.",,Not Reported,English
1232,Protected Areas Guinea-Bissau,"Institut of Biodiversity and Protected Areas (IBAP), GIS Bissau, GPC - Coastal Planning Office",Not Reported,2007,Not Reported,Not Reported,Not Reported,07/02/2007.  Point location derived from sketch map digitised at UNEP-WCMC.,,Not Reported,English
1238,Bentael,"UNEP, Nairobi, Kenya",Not Reported,1996,Not Reported,Not Reported,Not Reported,"""Biological Diversity of Lebanon"", UNEP Report, 1996.",,Not Reported,English
1241,Kambui North,Not Reported,Not Reported,1990,Not Reported,Not Reported,Not Reported,Not Reported,,Not Reported,English
1244,"Protected Areas ASEAN (Brunei Darussalam, Cambodia, Indonesia, Lao PDR, Malaysia, Philippines, Singapore, Thailand, Vietnam)",Association of Southeast Asian Nations (ASEAN) Regional Centre for Nature Conservation (ARCBC),Not Reported,2004,Not Reported,Not Reported,Not Reported,"Dataset dated 2004, February 2005. Also: Websites accessed 02/05 (Sourcebook of Existing & Proposed PA in Vietnam - BirdLife Int. (19/02/01); Kuala Selangor Nature Park Website, Malaysian Nature Soc; Dept. of Wildlife and NatParks (Malaysian Peninsula)",,Not Reported,English
1245,Indigenous areas Brazil,"BGE e Diretoria do Serviço Geográfico (DSG), Sistema de Terras Indígenas (STI) da Fundação Nacional do Índio (FUNAI) /DAF, Brazil",Not Reported,2005,Not Reported,Not Reported,Not Reported,"Base cartográfica do IBGE e DSG, escalas 1:25.000;  1:50.000;  1:100.000; 1: 250.000;  1:1.000.000.  Dados literais extraídos do STI (Sistema de Terras Indígenas) da FUNAI/DAF, 10/10/2005.",,Not Reported,English
1246,Protected Areas,"Projet Conseiller Forestier (PCF), Guinea",Not Reported,2000,Not Reported,Not Reported,Not Reported,"Basic map supplied by Chris Duvall and attributes taken from Projet Conseiller Forestier (PCF) - Sur la Diffusion de la Législation Forestière Guinéenne (21-23 Nov 2000) Report, accessed 10/03/2005.",,Not Reported,English
