metadataid,data_title,resp_party,resp_email,year,char_set,ref_system,scale,lineage,citation,disclaimer,language
1700,LMMAs of the Western Indian Ocean Database,"Blue Ventures, London, UK",shawn@blueventures.org,2012,Not Reported,WGS 84,Not Reported,Produced using Google Earth and exported to ArcGIS,"Blue Ventures Conservation (2012), LMMAs of the Western Indian Ocean Database. Toliara, Madagascar: Blue Ventures Conservation. 23 August 2012","Protected areas are accurate to the best of our knowledge, but specific locations for LMMAs less than 50km in size may vary from true values.",English
1701,Protected Areas in Cameroon,"Ministry of Forestry and Wildlife, Cameroon",aziekine@yahoo.fr,2011,Not Reported,GCS_Clarke_1980,Not Reported,Not Reported,"MINFOF (2011), Protected Areas in Cameroon",Not Reported,French and English
1703,Marine Protected Areas in the Philippines,"Coastal Conservation and Education Foundation (CCEF), Philippines",info@coast.ph,2012,Not Reported,WGS 84,Not Reported,Provided with shapefile containing boundary polygons of marine protected areas found in CCEF's MPA database ,,Not Reported,English
1706,Protected Areas of Israel,"Nature and National Parks Protection Authority, Israel",eliezer.frankenberg@npa.org.il,2011,ANSI,GCS Israel,Not Reported,GIS shapefiles and attribute information provided,,Not Reported,English
1707,"Protected Areas of Armenia, Azerbaijan, Georgia and Turkey","WWF Caucasus Office, 11 Alkesidze Street, 0193 Tbilise, Georgia",gberuchashvili@wwfcaucasus.org,2011,ANSI,WGS 84,Not Reported,Not Reported,,Not Reported,English
1708,Forest Reserves of Uganda,"National Forestry Authority, Plot 10/20, Spring Road, P.O.  Box 70863, Kampala, Uganda",info@nfa.org.ug,2011,ANSI,WGS 84,Not Reported,"Status Year, Reported Area and Names were reviewed and ammended as necessary. Boundaries were not updated but restored from a previous version of the WDPA (2007). ",,Not Reported,English
1709,Protected Areas of Uruguay,"Sistema Nacional de Areas Protegidas (SNAP), Ministerio de Vivienda y Ordenamiento Territorial y Medio Ambiente",lucia.bartesaghi@mvotma.gub.uy,2016,UTF-8,WGS 84,50000,Spatial data provided by SNAP in September 2016,,Not Reported,English
1710,Proposed Protected Areas of Madagascar,"WWF Madagascar and West Indian Ocean Programme Office, Madagascar",aandriamanalina@wwf.mg,2012,ANSI,WGS 84,Not Reported,Not Reported,,Not Reported,English
1713,National Parks of Gabon,World Resources Institute,www.wri.org,2012,ANSI,WGS 84,Not Reported,Not Reported,,"This work is licensed under the Creative Commons Attribution-NonCommercial-NoDerivative Works 3.0 License. To view a copy of the license, visit http://creativecommons. org/licenses/by-nc-nd/3.0/",English and French
1714,Protected areas and community conservation areas in Kenya,African Wildlife Foundation (AWF),africanwildlife@awf.org,2012,ANSI,WGS 84 and GCS_Arc_1960,Not Reported,"Data for Samburu (Kenya), Kilimanajro (Kenya/Tanzania) and Maasai Mara (Kenya) regions derived from various sources (topographic maps, partners, GPS).",,Not Reported,English
1715,Community-owned conservancies in Kenya,"Northern Rangelands Trust (NRT), Kenya",info@nrt-kenya.org,2012,ANSI,WGS 84,Not Reported,"These conservancies, under the umbrella of NRT, are autonomous institutions that represent a constituent/resident community over defined geog. area (community have legal/traditional land ownership) for purposes of wildlife cons. & rangeland management ",,Not Reported,English
1717,"Kokolopori and Salonga National Park, Democratic Republic of Congo","Department of Geography, University of Maryland.",jnackone@umd.edu,2012,ANSI,WGS 84,Not Reported,Not Reported,,Not Reported,English
1733,Ramsar Wetlands of International Importance,UNEP-WCMC and Ramsar Secretariat,protectedareas@unep-wcmc.org,2012,UTF-8,WGS 84,Not Reported,"Points created based on information from official Ramsar list and Ramsar Bulletin Board, December 2012. Polygon (WDPAID 67833) extended and renamed - polygon data from metadata IDs 895 and 947.",,Not Reported,English
1738,Protected Areas of Botswana,"Department of Wildlife and National Parks, Botswana",mflyman@gov.bw,2013,GCS GRS 1980,WGS 84,Not Reported,Not Reported,,Not Reported,English
1739,Aires Protégées du Mali,"Ministère de l'Environnement et de l'Assainissement, Direction des Eaux et Forêts, Bamako, Mali",Not Reported,2013,UTF-8,WGS 84,Not Reported,Not Reported,,Not Reported,French
1742,Protected Areas of Guyana,"Natural Resources Management Division, Environmental Protection Agency, Guyana",epa@epaguyana.org,2014,UTF-8,GCS Provisional S American 1956,Not Reported,Updated polygon boundaries for three protected areas.,,Not Reported,English
1744,National Parks of Tanzania,Tanzania National Parks (TANAPA),hamza01kija@yahoo.com,2013,UTF-8,UTM Arc1960 Zone 36S,Not Reported,Not Reported,Not Reported,Not Reported,English
1747,Forest Reserves of Tanzania,Tanzania Forest Services (TFS) Agency,emjohny@yahoo.co.uk,2013,UTF-8,UTM Arc1960 Zone 36S,Not Reported,Not Reported,Not Reported,Not Reported,English
1756,Protected Areas of Tchad,Direction des Parcs Nationaux et Reserves de Faune,kadio_amidou@yahoo.fr,2013,Not Reported,Not Reported,Not Reported,Not Reported,,Not Reported,French
1773,Protected Areas of New Zealand,"Department of Conservation (DOC), Te Papa Atawhai, Wellington, New Zealand",abignell@doc.govt.nz,2014,UTF-8,WGS 84,Not Reported,Not Reported,,Not Reported,English
1775,Privately protected areas of Kenya,"Zeitz Foundation, Kenya",liz@zeitzfoundation.org,2014,Not Reported,WGS 84,Not Reported,Not Reported,,Not Reported,English
1832,Natura 2000,Directorate-General for Environment (EU) via EEA,Not Reported,2014,UTF-8,EPSG:3035,1:1000000,http://www.eea.europa.eu/data-and-maps/data/natura-7,Natura 2000 data - the European network of protected sites,There are specific terms and conditions relating to the use of downloaded boundary data within the United Kingdom. If you intend to use the UK data you must first agree to the end user licence http://www.jncc.gov.uk/page-5232.,English
1776,Aires Protégées du Québec,"Ministere du Développement Durable, de l'Environnement, de la Faune et des Parcs, Direction du Patrimoine ecologique des parcs, Edifice Marie-Guyart, 4e etage boite 21, 675 bld René-Lévesque Est, Québec, Canada, G1R5V7 ",jacques.perron@mddefp.gouv.qc.ca,2014,Not Reported,Not Reported,Not Reported,Not Reported,"MDDEFP (2013) Registre des aires protégées au Québec, Canada. Disponible a l'adresse: (http://www.mddefp.gouv.qc.ca/biodiversite/aires_protegees/registre/index.htm)  [Données mises à jour en date du 11 novembre 2013].",Not Reported,French
1777,Protected Areas of Singapore,"National Biodiversity Centre, National Parks Board, Singapore",wendy_yap@nparks.gov.sg,2014,Not Reported,Not Reported,Not Reported,Reply to 2014 UN List Request,,Not Reported,English
1778,Protected Areas of Nepal,"Department of National Parks and Wildlife Conservation (DNPCWC), Ministry of Forests and Soil Conservation, Nepal",hbacharya07@gmail.com,2014,Not Reported,Not Reported,Not Reported,Reply to 2014 UN List Request and WDPA expert review in Asia Project,,Not Reported,English and Nepalese
1779,Protected Areas of Morocco,Haut Commissariat aux Eaux et Forêts et à la Lutte Contre la Désertification (HCEFLCD),"zouhairamhaouch@yahoo.fr ; adnrach@gmail.com",2014,Not Reported,"GCS_Merchich_Degree, Clarke_1880_IGN",Not Reported,Not Reported,,Not Reported,English and French
1800,Protected Areas of Bhutan,"""National Environment Commission, Wildlife Conservation Division""","""kc@nec.gov.bt, shabsangay@gmail.com""",2014,Not Reported,WGS 84,Not Reported,Not Reported,,Not Reported,English
1801,Protected Areas of the Comoros,Directorate of Environment and Forestry,medaliml@yahoo.fr,2014,Not Reported,UTM/WGS1984/ZONE 38°S,Not Reported,"Les données cartographiées prises sur la base de données géographique du département sig du ministère de la production, mise à jour des données à partir des relevés gps de terrain","Direction de l'environement et des forets et Autorite Compentente pour les Comores, 2014",Not Reported,English
1802,Protected Areas of Brazil,Ministério do Meio Ambiente,sergio.carvalho@mma.gov.br,2014,Not Reported,WGS 84,Not Reported,Not Reported,,Not Reported,English
1803,Protected Areas of Mongolia,Ministry of Environment and Green Development of Mongolia,"contact@mne.gov.mn, namkhai_spa@yahoo.com",2014,Not Reported,WGS 84,Not Reported,Not Reported,,Not Reported,English
1804,Protected Areas of Australia,Australian Department of the Environment and Energy,Glenn.Johnstone@environment.gov.au,2014,Not Reported,WGS 84,Not Reported,Not Reported,,Not Reported,English
1805,Protected Areas of United Arab Emirates,"Director, Biodiversity Department, Environment Affair and Nature Conservation Sector, Ministry of Climate Change and Environment",raalmheiri@moccae.gov.ae,2014,ANSI,WGS 84,Not Reported,Not Reported,,Not Reported,English
1806,Protected Areas of Sierra Leone,"Government of Sierra Leone, EPA Sierra Leone",jobosamba@yahoo.com,2014,ANSI,WGS 84_UTM_Z29,Not Reported,Not Reported,,Not Reported,English
1807,"Protected Areas of Antigua and Barbuda, Update of the PA dataset, subset of EIMAS","Chief Environment Officer, The Environment Division, Ministry of Environment, Government of Antigua and Barbuda",trilov@hotmail.com,2014,ANSI,EPSG:2001 - Antigua 1943 / British West Indies Grid,Not Reported,Not Reported,,Not Reported,English
1808,Protected Areas System of Chile,"Ministerio del Medio Ambiente, Division de Recursos Naturales, Renovables y Biodiversidad",DFlores@mma.gob.cl,2016,ANSI,WGS_1984_UTM_Zone_19S,Not Reported,Not Reported,,Not Reported,English and Spanish
1809,Protected Areas of Saint Vincent and the Grenadines,"Permanent Secretary, Ministry of Health, Wellness and the Environment",moehsvg@gov.vc / moehsvg@gmail.com / clintlewis784@gmail.com,2014,ANSI,WGS_1984_UTM_Zone_20N,Not Reported,Not Reported,,Not Reported,English
1833,Protected Areas of Jordan,"The Royal Society for the Conservation of Nature, Jordan",mohammed.zaarour@rscn.org.jo,2014,Not Reported,WGS 84,Not Reported,Not Reported,,Not Reported,English and Arabic
1834,"Natural Park of the Coral Sea, New Caledonia",Direction des affaires maritimes de la Nouvelle-Calédonie,regis.etaix-bonnin@gouv.nc,2014,Not Reported,RGNC_1991_93_Lambert_New_Caledonia,Not Reported,Not Reported,,http://ec.europa.eu/environment/nature/natura2000/db_gis/index_en.htm#sites,English and French
1783,Quasi National Park of Japan,"Ministry of the Environment, Government of Japan",NBSAP@evn.go.jp,2014,UTF-8,WGS 84,Not Reported,Not Reported,"Ministry of the Environment, Government of Japan, 2011",Not Reported,English and Japanese
1810,Protected Areas of Argentina / Áreas Protegidas Nacionales de Argentina,"Administración de Parques Nacionales, Dirección Nacional de Conservación de Áreas Protegidas, Sistema de Información de Biodiversidad",llizarraga@apn.gov.ar,2014,UTF-8,Geographic Coordinate System: World Geodetic Survey (WGS) 1984. EPSG:4326.,100000,"Para su elaboración se recopilaron los límites de 46 áreas protegidas nacionales más 9 de las Reservas Naturales de la Defensa y el área marina protegida Namuncurá - Banco Burdwood, aportados por las oficinas técnicas regionales de APN.","Administración de Parques Nacionales. “YEAR”. Áreas Protegidas Nacionales de Argentina. Sistema de Información de Biodiversidad. www.sib.gov.ar. Dirección Nacional de Conservación de Áreas Protegidas, Argentina.","Los límites de las áreas protegidas nacionales son ilustrativos. La representación de los límites internacionales es aproximada e indicativa, su información no compromete a las Repúblicas de Argentina y países limítrofes. ",English and Spanish
1811,Protected Areas of Peru,"Operativa Funcional de Gestion de la Informacion del SERNANP; Responsable de la Gestión del Información Espacial del SERNANP",gvilela@sernanp.gob.pe,2016,ANSI,WGS 84,Not Reported,Not Reported,Not Reported,Not Reported,English and Spanish
1812,Protected Areas of Tajikistan,National Center for Biodiversity and Biosafety,"biodiv@biodiv.tojikiston.com, nsafarov@biodiv.tojikiston.com",2014,Not Reported,WGS 84,Not Reported,Not Reported,,Not Reported,English
1813,Protected Areas of Algeria,Algeria NPF and PoWPA FP,chenoufnadia@yahoo.fr,2014,Not Reported,WGS 84,Not Reported,Not Reported,,Not Reported,English and French
1814,Protected Areas of Egypt,"Egyptian Environmental Affairs Agency, Ministry of Environment",khaledallam4@yahoo.com ,2014,Not Reported,Not Reported,Not Reported,Not Reported,,Not Reported,English
1815,Protected Areas of Kyrgyzstan,Department of International Cooperation. State Agency on Environment Protection and Forestry of the Kyrgyz Republic,min-eco@elcat.kg,2014,Not Reported,Not Reported,Not Reported,Not Reported,,Not Reported,English
1816,Protected Areas of Lebanon,"Department of Ecosystems, Ministry of Environment",L.Samaha@moe.gov.lb,2014,Not Reported,Not Reported,Not Reported,Not Reported,,Not Reported,English
1817,Protected Areas of Mali,Mali NPF and PoWPA FP,Not Reported,2014,Not Reported,Not Reported,Not Reported,Not Reported,,Not Reported,French
1818,Protected Areas of Niger,Niger NPF and PoWPA FP,Not Reported,2014,Not Reported,Not Reported,Not Reported,Not Reported,,Not Reported,French
1819,Protected Areas of Mauritius,"National Parks and Conservation Service, Ministry of Agro Industry and Food Security",parmananda.ragen@gmail.com,2014,Not Reported,WGS 84,Not Reported,Not Reported,,Not Reported,English
1820,Protected Areas of Sudan,Sudan NPF and PoWPA FP,adamasmahassan@yahoo.com,2014,Not Reported,Not Reported,Not Reported,Not Reported,,Not Reported,English
1821,Protected Areas of Namibia,Not Reported,jndokosho@met.na,2014,Not Reported,Not Reported,Not Reported,Not Reported,,Not Reported,English
1822,Protected Areas of Angola,Ministério do Ambiente,aristofanesp@yahoo.com.br,2014,Not Reported,Not Reported,Not Reported,Not Reported,,Not Reported,English and Portuguese
1823,Protected Areas of the Congo,Agence Congolaise de la Faune et des Aires Protégées (ACFAP),aste_dalvy@yahoo.fr,2014,Not Reported,Not Reported,Not Reported,Not Reported,,Not Reported,French
1824,Protected Areas of Togo,Direction de la Faune et de la Chasse,atsrihonam@yahoo.fr,2014,UTF-8,WGS 84,Not Reported,Not Reported,,Not Reported,English and French
1825,Protected Areas of Azerbaijan,Azerbaijan NPF and PoWPA FP,Not Reported,2014,Not Reported,Not Reported,Not Reported,Not Reported,,Not Reported,English
1826,Protected Areas of Cote d'Ivoire,Office Ivoirien des Parcs et Reserves,adama.tondossama@oipr.ci,2014,Not Reported,Not Reported,Not Reported,Not Reported,,Not Reported,English and French
1827,Protected Areas of Libya,"Nature Conservation Dept, Environment General Authority",eaburass@yahoo.fr,2014,Not Reported,Not Reported,Not Reported,Not Reported,,Not Reported,English
1828,Protected Areas of Mozambique,Mozambique NPF and PoWPA FP,"vmacandza2001@yahoo.com, dpechisso@yahoo.com.br, melinhapaula@yahoo.com.br",2014,Not Reported,Not Reported,Not Reported,Not Reported,,Not Reported,English
1829,Protected Areas of Zimbabwe,Ministry of Environment and Natural Resources Management,chipangura.chirara@undp.org,2014,Not Reported,Not Reported,Not Reported,Not Reported,,Not Reported,English
1831,Protected Areas of Honduras,Dirección General de Biodiversidad - SERNA,dibioserna@hotmail.es,2014,Not Reported,Not Reported,Not Reported,Not Reported,,Not Reported,English and Spanish
1835,Protected Areas of Djibouti,"Direction de l'Aménagement du Territoire et de l'Environnement/ Ministère de l'Habitat, de l'Urbanisme et de l'Environnement",distri_play@yahoo.fr,2014,Not Reported,Not Reported,Not Reported,Polygons created from latitudes & longitudes from documents submitted by the Ministry of the Environment,,Not Reported,French
1836,Protected Areas of Swaziland,Swaziland National Trust Commission,director@sntc.org.sz,2014,Not Reported,GCS_Cape,Not Reported,Not Reported,,Not Reported,English
1837,Protected Areas of Rwanda,"Ministry of Environment and Lands, Rwanda",francois.bizimungu@rdb.rw,2014,Not Reported,ITRF_2005 and WGS_1984_UTM_Zone_35S,Not Reported,Not Reported,,Not Reported,English
1838,Protected Areas of Armenia,"Ministry of Nature Protection, Armenia",interdpt@yahoo.com,2014,Not Reported,WGS 84,Not Reported,"Attribute data provided by Ministry of Nature Protection, Armenia, 2014. Spatial data from metadata IDs 1707 and 1711 (WWF Caucasus office, Georgia), 2011/2012",,Not Reported,English
1839,Common Database on Designated Areas (ECDDA version 13) as provided by the European Environment Agency (EEA),European Environment Agency (EEA),Mette.Lund@eea.europa.eu,2014,ANSI,EPSG:3035 converted to WGS 84,Various,Submitted by National Reference Centres to the European Environment Agency's ReportNet then collated by the European Topic Centre on Biological Diversity and formatted for the WDPA including only records with dissemination code '01'.,"The Common Database on Designated Areas (CDDA)
http://www.eea.europa.eu/data-and-maps/data/nationally-designated-areas-national-cdda-10#tab-metadata","EEA standard re-use policy: unless otherwise indicated, re-use of content on the EEA website for commercial or non-commercial purposes is permitted free of charge, provided that the source is acknowledged (http://www.eea.europa.eu/legal/copyright). Copyright holder: European Environment Agency (EEA). When re-using the data, copyright is to be mentioned specifically for Estonia and for Finland: ""Estonian Environmental Register 25.02.2014""; ""©Finnish Environment Institute, 2014""
http://www.eea.europa.eu/data-and-maps/data/nationally-designated-areas-national-cdda-10",Multiple
1840,South Africa Protected Areas Database (SAPAD_UNEP_OR_2016),Department of Environmental Affairs,LTshikovhi@environment.gov.za,2014,US-ASCII,GCS_WGS_1984,1/5000,This SAPAD Geodatabase is a product that is extracted from the Protected and Conserved Areas (PACA) geo-database. The PACA-SQL geo-database is updated and maintained on a daily basis. SAPAD extractions are done in the last week of each quarter.,,Not Reported,English
1841,Protected Areas of the Philippines,"Biodiersity Management Bureau, Department of Environment and Natural Resources",sj_cabrera@yahoo.com,2014,Not Reported,Not Reported,Not Reported,Data provided as an output of WDPA expert review in Asia project,,Not Reported,English
1843,Protected Areas of Oman,Ministry of Environment and Climate Affairs,amalkamzari@gmail.com,2014,Not Reported,WGS 84,Not Reported,Points and polygons created from jpeg pictures sent by MoE&C,,Not Reported,English and Arabic
1844,Protected Areas of Belize,National Protected Areas Secretariat (NPAS),co.npas@ffsd.gov.bz,2014,ANSI,NAD_1927_UTM_Zone_16N,Not Reported,Not Reported,,Not Reported,English
1845,Protected Areas of Ascension Island,"Conservation Office, Ascension Island Government",sam.weber@ascension.gov.ac,2014,Not Reported,WGS_1984_UTM_Zone_28S,Not Reported,Not Reported,,Not Reported,English
1846,Privately protected areas of the UK,"Putting Nature on the Map, IUCN",mahon276@btinternet.com,2014,Not Reported,Not Reported,Not Reported,Not Reported,,Not Reported,English
1847,Protected Areas of South Sudan,"South Sudan National Wildlife Service (SSWS); Wildlife Conservation Society (WCS) South Sudan Program","khamis_ding@yahoo.com; minasonalero@yahoo.com; jmoi@wcs.org",2014,Not Reported,WGS 84,Not Reported,"Various historical conservation documents (inc. GoS. 1982. Wildlife Information Booklet, MWCT, Dept’ of Wildlife Management, Southern Region). Adjustments and expansions based on ecological and socioeconomic research conducted by WCS/SSWS, 2007 - 2014.",SSWS and WCS (2014) Protected Areas of South Sudan (version 2).,"Protected area boundaries and designations are indicative and may be subject to adjustment and revision based on gap assessment and ground truthing processes. Changes might include adjusted boundaries, new PAs and extensions.",English
1848,"Protected Areas Database of the United States (PADUS), version 1.4. Marine Protected Areas ","US Geological Survey, Gap Analysis Program (GAP), National Operations Office, Boise State University",lduarte@uidaho.edu,2014,UTF-8,WGS 84,Not Reported,Not Reported,"US Geological Survey, Gap Analysis Program (GAP).  June 2016.  Pre-release Protected Areas Database of the United States (PADUS), version 1.4 Marine Protected Areas.  National Operations Office, University of Idaho.",Not Reported,English
1849,L’Agence des aires marines protégées ,L’Agence des aires marines protégées ,Not Reported,2014,UTF-8,WGS 84,Not Reported,Not Reported,,Not Reported,French
1782,National Park of Japan,"Ministry of the Environment, Government of Japan",NBSAP@evn.go.jp,2014,UTF-8,WGS 84,Not Reported,Not Reported,"Ministry of the Environment, Government of Japan, 2013",Not Reported,English and Japanese
1899,Protected Areas of the Dutch Caribbean,Dutch Caribbean Nature Alliance,info@dcnanature.org,2004,UTF-8,WGS 84,Not Reported,Not Reported,Not Reported,Not Reported,English
1784,Prefectural Natural Park of Japan,"Ministry of the Environment, Government of Japan",NBSAP@evn.go.jp,2014,UTF-8,WGS 84,Not Reported,Not Reported,"Ministry of the Environment, Government of Japan, 2010",Not Reported,English and Japanese
1785,Wilderness Area of Japan,"Ministry of the Environment, Government of Japan",NBSAP@evn.go.jp,2014,UTF-8,WGS 84,Not Reported,Not Reported,"Ministry of the Environment, Government of Japan, 2011",Not Reported,English and Japanese
1786,Nature Conservation Area of Japan,"Ministry of the Environment, Government of Japan",NBSAP@evn.go.jp,2014,UTF-8,WGS 84,Not Reported,Not Reported,"Ministry of the Environment, Government of Japan, 2011",Not Reported,English and Japanese
1787,Prefectural Nature Conservation Area of Japan,"Ministry of the Environment, Government of Japan",NBSAP@evn.go.jp,2014,UTF-8,WGS 84,Not Reported,Not Reported,"Ministry of the Environment, Government of Japan, 2011",Not Reported,English and Japanese
1788,National Wildlife Protection Area of Japan,"Ministry of the Environment, Government of Japan",NBSAP@evn.go.jp,2014,UTF-8,WGS 84,Not Reported,Not Reported,"Ministry of the Environment, Government of Japan, 2012",Not Reported,English and Japanese
1789,Prefectural Wildlife Protection Area of Japan,"Ministry of the Environment, Government of Japan",NBSAP@evn.go.jp,2014,UTF-8,WGS 84,Not Reported,Not Reported,"Ministry of the Environment, Government of Japan, 2013",Not Reported,English and Japanese
1790,Natural Habitat Conservation Area of Japan,"Ministry of the Environment, Government of Japan",NBSAP@evn.go.jp,2014,UTF-8,WGS 84,Not Reported,Not Reported,"Ministry of the Environment, Government of Japan, 2010",Not Reported,English and Japanese
1792,UNESCO-MAB Biosphere Reserve of Japan,"Ministry of the Environment, Government of Japan",NBSAP@evn.go.jp,2014,UTF-8,WGS 84,Not Reported,Not Reported,"Ministry of the Environment, Government of Japan, 2006",Not Reported,English and Japanese
1797,Protected Areas of Bangladesh,Bangladesh Forest Department,tarik.forest@gmail.com,2014,Not Reported,WGS 84,Not Reported,Not Reported,,Not Reported,English and Bengali
1798,Protected Areas of The Gambia,"Department of Parks and Wildlife Management and National Environment Agency, Banjul, The Gambia",oustouray@gmail.com,2014,Not Reported,WGS 84,Not Reported,Not Reported,,Not Reported,English and Bengali
1850,"Base de Datos Geográfica de Áreas Naturales Protegidas Federales, Sitios Ramsar, UNESCO-MAB, Patrimonio Mundial de México",Comisión Nacional de Áreas Naturales Protegidas (CONANP),edgar.delvillar@conanp.gob.mx,2014,ANSI,WGS 84,Not Reported,Not Reported,,Not Reported,English and Spanish
1851,Protected Areas of Iraq,Ministry of Environment of Iraq,aaza59@yahoo.com,2014,ANSI,WGS 84,Not Reported,"No database for storing the currently available information on PAs in Iraq exists. We provide a shp in ESRI format with information concerning: the name, coordinates, brief description, status, type of designation, reported area",,Not Reported,English and Arabic
1852,"Areas Protegidas Provinciales, Reservas de Biosfera MaB-UNESCO, Sitios RAMSAR  and Bienes de Patrimonio Mundial Natural y Cultural de Argentina",Grupo de Trabajo sobre Áreas Protegidas Subsecretaría de Planificación y Política Ambiental Secretaría de Ambiente y Desarrollo Sustentable,jfabri@ambiente.gob.ar,2014,ANSI,WGS 84,Not Reported,Not Reported,,Not Reported,English and Spanish
1853,Protected areas of Indonesia,Ministry of Forestry(MoF) Ministry of Marine Affairs & Fisheries (MMAF),rudijanta@gmail.com suraji_a@yahoo.com,2014,Not Reported,WGS 84,Not Reported, Data provided as an output of WDPA expert review in Asia project. For MPAs Indonesian MPA database was used for cross checking of the data provided. (http://kkji.kp3k.kkp.go.id/index.php/en/marine-protected-area-data),,Not Reported,English
1854,Protected areas in Sri Lanka,Forest Department of Sri Lanka,ariyadasa@yahoo.com,2015,Not Reported,GCS_Kandawala,Not Reported,Data provided as an output of WDPA expert review in Asia project.,,Not Reported,English
1855,Protected areas of India,Wildlife Insitute India,Not Reported,2014,Not Reported,Not Reported,Not Reported,Only tabular data was provided (Data provided as an output of WDPA expert review in Asia project),,Not Reported,English
1856,Ramsar Wetlands of International Importance,"Ramsar Secretariat, on behalf of Ramsar Contracting Parties",ramsar@ramsar.org,2015,ANSI,WGS 84,Various,Contracting Parties create the original shapefiles used for the official maps and send these to Ramsar Secretariat. Sites are retrieved from: https://rsis.ramsar.org/,"Ramsar Convention and Wetlands International (2016), Ramsar Sites Information Service [On-line]",Not Reported,Multiple
